"Dealer ID","Stock","Type","VIN","Year","Make","Model","Trim","ModelNumber","ExteriorColor","ExteriorColorCode","InteriorColor","InteriorColorCode","Seats","Navigation","Wheel Size","MoonRoof","DriverSeatControl","PassengerSeatControl","Engine","Transmission","Miles","DateInStock","AdditionalSpecs","Body","Series","EngineCylinders","EngineDisplacement","Drivetrain","DealersNotes","MSRP","BaseMSRP","Invoice","ImageList","Video_URL","OtherMedia","DamageWaiverValue","OptionCode","OptionDescription","Certified","DMSStatus","List Price"
"dealership1","K8539A","Used","KNDJ23AU9L7116259","2020","Kia","Soul","S","B2532","Mars Orange","M3R","Black/Gray","GDM","","","","","","","Regular Unleaded I-4 2.0 L/122","Variable","19835","10/19/2021","CARPETED FLOOR MATS,BLACK/GRAY  WOVEN CLOTH SEAT TRIM,EC MIRROR W/COMPASS & HOMELINK,REAR BUMPER APPLIQUE,CARGO NET,MARS ORANGE,Front Wheel Drive,Power Steering,ABS,4-Wheel Disc Brakes,Brake Assist,Aluminum Wheels,Tires - Front All-Season,Tires - Rear All-Season,Temporary Spare Tire,Power Mirror(s),Rear Defrost,Privacy Glass,Intermittent Wipers,Variable Speed Intermittent Wipers,Power Door Locks,Daytime Running Lights,Automatic Headlights,AM/FM Stereo,Steering Wheel Audio Controls,Bluetooth Connection,Smart Device Integration,MP3 Player,Auxiliary Audio Input,Bucket Seats,Pass-Through Rear Seat,Rear Bench Seat,Adjustable Steering Wheel,Trip Computer,Power Windows,Keyless Entry,Power Door Locks,Cruise Control,A/C,Cloth Seats,Driver Vanity Mirror,Passenger Vanity Mirror,Power Windows,Power Door Locks,Trip Computer,Traction Control,Stability Control,Traction Control,Front Side Air Bag,Blind Spot Monitor,Lane Departure Warning,Lane Keeping Assist,Lane Departure Warning,Front Collision Mitigation,Driver Monitoring,Rear Collision Mitigation,Tire Pressure Monitor,Driver Air Bag,Passenger Air Bag,Front Head Air Bag,Rear Head Air Bag,Passenger Air Bag Sensor,Child Safety Locks,Back-Up Camera","Hatchback","S","4","2.0 L","FWD","<p> KBB.com 10 Favorite New-for-2020 Cars. Delivers 35 Highway MPG and 29 City MPG! Carfax One-Owner Vehicle. Dealer Certified Pre-Owned. This Kia Soul boasts a Regular Unleaded I-4 2.0 L/122 engine powering this Variable transmission. Wheels-Alloy, Tilt Steering, Seats-Cloth. <p><strong>This Kia Soul Comes Equipped with These Options </strong><br /> Power Windows, Power Mirrors, Power Locks, Cruise Control, Blue-tooth, Backup Camera, Aux Audio Input, Air Conditioning, Air Bags, REAR BUMPER APPLIQUE. </p> <p><strong> Know You're Making a Reliable Purchase </strong><br /> Carfax reports: Carfax One-Owner Vehicle, No Damage Reported, No Accidents Reported, 9 Service Records. </p> <p><strong> This Kia Soul is a Superstar! </strong><br /> KBB.com 10 Coolest New Cars Under $20,000, KBB.com 10 Favorite New-for-2020 Cars. </p> <p><strong> Visit Us Today </strong><br> Stop by Jenkins Kia of Ocala located at 2305 SW College Road, Ocala, FL 34471 for a quick visit and a great vehicle!</p>","25300","25300","0","https://content.homenetiol.com/2001453/2131934/640x480/5d72fd940d97444da840108f2e59387d.jpg,https://content.homenetiol.com/2001453/2131934/640x480/1b0f395c327c484daeb7e4b1924b2e98.jpg,https://content.homenetiol.com/2001453/2131934/640x480/5b9e00280d7949ccb40f01557a2336a1.jpg,https://content.homenetiol.com/2001453/2131934/640x480/e48758dd3eaf4ee6be2364e0226959f5.jpg,https://content.homenetiol.com/2001453/2131934/640x480/94297089821f4cc9ab50a3969f3ee1a2.jpg,https://content.homenetiol.com/2001453/2131934/640x480/0db2c7a34475481f8b05fca61c40e747.jpg,https://content.homenetiol.com/2001453/2131934/640x480/0934edce5fc6430d847b014449aa6e7d.jpg,https://content.homenetiol.com/2001453/2131934/640x480/84b19404ea56422e97000e88e3a0240a.jpg,https://content.homenetiol.com/2001453/2131934/640x480/5d15d3d795774fd9a474b50e251d00d7.jpg,https://content.homenetiol.com/2001453/2131934/640x480/fd7067ac7a394e9facb7b2ecc5f56b56.jpg,https://content.homenetiol.com/2001453/2131934/640x480/4eac89bdcee849ae9370becc0c00e606.jpg,https://content.homenetiol.com/2001453/2131934/640x480/8016387092d446a98b2c9ba736bebcea.jpg,https://content.homenetiol.com/2001453/2131934/640x480/c1dec93be57e427a82a43a47ca0049aa.jpg,https://content.homenetiol.com/2001453/2131934/640x480/5165c17d62b34de6a26bca37db0d0c5f.jpg,https://content.homenetiol.com/2001453/2131934/640x480/71f879374e7748938f2c93aa7cb2782c.jpg,https://content.homenetiol.com/2001453/2131934/640x480/d0a33bfca19c4dd7a2e611511e67f084.jpg,https://content.homenetiol.com/2001453/2131934/640x480/abd73e6fa6ef41ad896ce37379dea83f.jpg,https://content.homenetiol.com/2001453/2131934/640x480/e13cc9eddc2b4a37a0e0fe6aa102d559.jpg,https://content.homenetiol.com/2001453/2131934/640x480/bee6e15f16e64cc3a2d5d72ece092897.jpg,https://content.homenetiol.com/2001453/2131934/640x480/c9856323565e4087981ad897fd18a5f4.jpg,https://content.homenetiol.com/2001453/2131934/640x480/3b633c09eb71405b971812a376e70593.jpg,https://content.homenetiol.com/2001453/2131934/640x480/dda418d9aba84520a6ab0152837f43e3.jpg,https://content.homenetiol.com/2001453/2131934/640x480/c5fd0e08d63f4ddfa32069e41f2a84c5.jpg,https://content.homenetiol.com/2001453/2131934/640x480/4c3e0c4e89f3416592e0b009011b4489.jpg,https://content.homenetiol.com/2001453/2131934/640x480/97b71a9594614524a77164816768c7c4.jpg","","","","CN,EH,BA-0,M3R,CF,GDM","","Yes","","22500"
"dealership1","K8441A","Used","3KPF24AD3LE173195","2020","Kia","Forte","FE","C3412","Gravity Grey","KDG","Black","WK","","","","","","","Regular Unleaded I-4 2.0 L/122","Variable","20799","10/19/2021","GRAVITY GREY,BLACK  WOVEN CLOTH SEAT TRIM,REAR BUMPER APPLIQUE,EC MIRROR W/COMPASS & HOMELINK,CARPET FLOOR MATS,CARGO MAT,Front Wheel Drive,Power Steering,ABS,4-Wheel Disc Brakes,Brake Assist,Wheel Covers,Steel Wheels,Tires - Front All-Season,Tires - Rear All-Season,Power Mirror(s),Rear Defrost,Intermittent Wipers,Variable Speed Intermittent Wipers,Daytime Running Lights,Automatic Headlights,AM/FM Stereo,MP3 Player,Bluetooth Connection,Auxiliary Audio Input,Smart Device Integration,Steering Wheel Audio Controls,Bucket Seats,Rear Bench Seat,Adjustable Steering Wheel,Trip Computer,Power Windows,Keyless Entry,Power Door Locks,Remote Trunk Release,Cruise Control,A/C,Cloth Seats,Driver Vanity Mirror,Passenger Vanity Mirror,Power Windows,Power Door Locks,Trip Computer,Security System,Traction Control,Stability Control,Traction Control,Front Side Air Bag,Lane Departure Warning,Lane Keeping Assist,Lane Departure Warning,Front Collision Mitigation,Driver Monitoring,Tire Pressure Monitor,Driver Air Bag,Passenger Air Bag,Front Head Air Bag,Rear Head Air Bag,Passenger Air Bag Sensor,Child Safety Locks,Back-Up Camera","4dr Car","FE","4","2.0 L","FWD","<p> Scores 41 Highway MPG and 31 City MPG! Carfax One-Owner Vehicle. This Kia Forte delivers a Regular Unleaded I-4 2.0 L/122 engine powering this Variable transmission. REAR BUMPER APPLIQUE, GRAVITY GREY, EC MIRROR W/COMPASS & HOMELINK. <p><strong> This Kia Forte Features the Following Options </strong><br /> CARPET FLOOR MATS, CARGO MAT, BLACK, WOVEN CLOTH SEAT TRIM, Woven cloth seat trim, Window Grid Antenna, Wheels: 15 Steel w/Wheel Covers, Variable Intermittent Wipers, Urethane Gear Shifter Material, Trunk Rear Cargo Access, Trip Computer. </p> <p><strong> Feel Confident About Your Choice </strong><br /> Carfax reports: Carfax One-Owner Vehicle, No Damage Reported, No Accidents Reported, 9 Service Records. </p> <p><strong> Stop By Today </strong><br> Live a little- stop by Jenkins Kia of Ocala located at 2305 SW College Road, Ocala, FL 34471 to make this car yours today! </p>","24300","24300","0","https://content.homenetiol.com/2001453/2131934/640x480/7bbc2fad937949b8a61514b653f0c8ac.jpg,https://content.homenetiol.com/2001453/2131934/640x480/e691c8a3a1bb478abf7ea7027fc9c692.jpg,https://content.homenetiol.com/2001453/2131934/640x480/5df8b085a4ba48089707a40d2a01b62d.jpg,https://content.homenetiol.com/2001453/2131934/640x480/5eff4dd032c64c4b83b2bf3cc3434b07.jpg,https://content.homenetiol.com/2001453/2131934/640x480/eb74c19cd2544b63a2e35fc53ff757fb.jpg,https://content.homenetiol.com/2001453/2131934/640x480/7e3efcccd06845afa544b59fb8594019.jpg,https://content.homenetiol.com/2001453/2131934/640x480/d597c8f52dfa4213b082883ef57e7a26.jpg,https://content.homenetiol.com/2001453/2131934/640x480/55eece239dd246189b31e6ec8ee56e74.jpg,https://content.homenetiol.com/2001453/2131934/640x480/1c1696f9bc6b474db4230616af0a0251.jpg,https://content.homenetiol.com/2001453/2131934/640x480/c872bcc30c63477482781e2188c107d0.jpg,https://content.homenetiol.com/2001453/2131934/640x480/79950f237cc14372960932de3ff585c7.jpg,https://content.homenetiol.com/2001453/2131934/640x480/bbb28e7cdd8e4803ad00ef6255787db6.jpg,https://content.homenetiol.com/2001453/2131934/640x480/10dc67d806cb4604a7c2ea7aa943683c.jpg,https://content.homenetiol.com/2001453/2131934/640x480/9566ab177e584218bc80f79bbb55300e.jpg,https://content.homenetiol.com/2001453/2131934/640x480/84525e9fe8ae43c1b026be62c06afebc.jpg,https://content.homenetiol.com/2001453/2131934/640x480/734528f436da4caaa7ae256d518f8de2.jpg,https://content.homenetiol.com/2001453/2131934/640x480/aed354f6a9de4a5d9a157885e26fcc47.jpg,https://content.homenetiol.com/2001453/2131934/640x480/11bf7a73b4eb4b12b8f97edf5f564ce9.jpg,https://content.homenetiol.com/2001453/2131934/640x480/4cee15088e844e35a535ba21fa2dfa9d.jpg,https://content.homenetiol.com/2001453/2131934/640x480/e53024179613457a8c4d5aff99312c37.jpg,https://content.homenetiol.com/2001453/2131934/640x480/79a228a2dcd6409bbb166e79c4e563e4.jpg,https://content.homenetiol.com/2001453/2131934/640x480/88c74357d31d4606b11085dba619a9f1.jpg,https://content.homenetiol.com/2001453/2131934/640x480/dbe7e2929e5549869f4c85cd21986410.jpg,https://content.homenetiol.com/2001453/2131934/640x480/46bdd0b1f48846ecbfd0ed42dd5cbd78.jpg","","","","KDG,WK-I,BA,EH,CF,CA","","Yes","","21500"
"dealership1","K8517A","Used","KNDPN3AC1L7649473","2020","Kia","Sportage","EX","42242","Snow White Pearl","SWP","Gray","GBU","","","","","","","Regular Unleaded I-4 2.4 L/144","Automatic","31873","10/26/2021","GRAY  LEATHER SEAT TRIM,GRAY  LEATHERETTE SEAT TRIM  -inc: YES Essentials,SNOW WHITE PEARL,CROSS BARS,CARPET FLOOR MATS,EX TECHNOLOGY PACKAGE  -inc: Ventilated Front Seats  Front & Rear Park Assist System  Compact Spare Tire  Electronic Parking Brake (EPB)  Smart Cruise Control w/Stop & Go  8-Way Power Adjustable Passenger Seat  height adjuster  Heated Steering Wheel  Auto-Dimming Rear View Mirror w/Homelink & Compass  Panoramic Sunroof  power sunshade  LED Interior Lighting  Radio: AM/FM/MP3 Premium Audio System  320 Watts  8 touchscreen  UVO link  navigation  harman/kardon sound system  8 speakers including subwoofer and tweeters  Clari-Fi digital audio restoration  SiriusXM satellite radio  additional USB port  wireless charging pad  Bluetooth wireless technology  voice control  Android Auto and Apple CarPlay,Front Wheel Drive,Power Steering,ABS,4-Wheel Disc Brakes,Brake Assist,Aluminum Wheels,Tires - Front Performance,Tires - Rear Performance,Heated Mirrors,Power Mirror(s),Integrated Turn Signal Mirrors,Power Folding Mirrors,Rear Defrost,Privacy Glass,Intermittent Wipers,Variable Speed Intermittent Wipers,Rear Spoiler,Remote Trunk Release,Power Liftgate,Power Door Locks,Daytime Running Lights,Automatic Headlights,Automatic Highbeams,Fog Lamps,AM/FM Stereo,MP3 Player,Bluetooth Connection,Smart Device Integration,MP3 Player,Steering Wheel Audio Controls,Auxiliary Audio Input,Power Driver Seat,Bucket Seats,Heated Front Seat(s),Driver Adjustable Lumbar,Pass-Through Rear Seat,Rear Bench Seat,Adjustable Steering Wheel,Trip Computer,Power Windows,Leather Steering Wheel,Keyless Entry,Power Door Locks,Keyless Entry,Power Door Locks,Keyless Start,Hands-Free Liftgate,Cruise Control,Climate Control,Multi-Zone A/C,A/C,Premium Synthetic Seats,Driver Vanity Mirror,Passenger Vanity Mirror,Driver Illuminated Vanity Mirror,Passenger Illuminated Visor Mirror,Keyless Start,Power Door Locks,Power Windows,Trip Computer,Security System,Engine Immobilizer,Traction Control,Stability Control,Traction Control,Front Side Air Bag,Lane Departure Warning,Lane Keeping Assist,Lane Departure Warning,Front Collision Mitigation,Driver Monitoring,Blind Spot Monitor,Cross-Traffic Alert,Tire Pressure Monitor,Driver Air Bag,Passenger Air Bag,Front Head Air Bag,Rear Head Air Bag,Passenger Air Bag Sensor,Child Safety Locks,Back-Up Camera","Sport Utility","EX","4","2.4 L","FWD","<p> Boasts 30 Highway MPG and 23 City MPG! Carfax One-Owner Vehicle. This Kia Sportage boasts a Regular Unleaded I-4 2.4 L/144 engine powering this Automatic transmission. SNOW WHITE PEARL, GRAY, LEATHERETTE SEAT TRIM  -inc: YES Essentials, GRAY, LEATHER SEAT TRIM. <p><strong>This Kia Sportage Comes Equipped with These Options </strong><br /> EX TECHNOLOGY PACKAGE  -inc: Ventilated Front Seats, Front & Rear Park Assist System, Compact Spare Tire, Electronic Parking Brake (EPB), Smart Cruise Control w/Stop & Go, 8-Way Power Adjustable Passenger Seat, height adjuster, Heated Steering Wheel, Auto-Dimming Rear View Mirror w/Homelink & Compass, Panoramic Sunroof, power sunshade, LED Interior Lighting, Radio: AM/FM/MP3 Premium Audio System, 320 Watts, 8 touchscreen, UVO link, navigation, harman/kardon sound system, 8 speakers including subwoofer and tweeters, Clari-Fi digital audio restoration, SiriusXM satellite radio, additional USB port, wireless charging pad, Bluetooth wireless technology, voice control, Android Auto and Apple CarPlay , CROSS BARS, CARPET FLOOR MATS, Wheels: 18 Alloy, Vinyl Door Trim Insert, Variable Intermittent Wipers w/Heated Wiper Park, Trunk/Hatch Auto-Latch, Trip Computer, Transmission: Electronic 6-Speed Automatic w/OD -inc: sportmatic shifting,, Transmission w/Driver Selectable Mode. </p> <p><strong> Know You're Making a Reliable Purchase </strong><br /> Carfax reports: Carfax One-Owner Vehicle, No Damage Reported, No Accidents Reported, 9 Service Records. </p> <p><strong> Stop By Today </strong><br> A short visit to Jenkins Kia of Ocala located at 2305 SW College Road, Ocala, FL 34471 can get you a tried-and-true Sportage today!</p>","33300","33300","0","https://content.homenetiol.com/2001453/2131934/640x480/4e8311fbd66d47b1987a3687ec8f0b02.jpg,https://content.homenetiol.com/2001453/2131934/640x480/90b38dad0b8e438ba733f15ab4ad0e58.jpg,https://content.homenetiol.com/2001453/2131934/640x480/8763ee6e45cc4d0a8556bb5d30413df7.jpg,https://content.homenetiol.com/2001453/2131934/640x480/8a1a8881c0584f2e87994e93233ffa10.jpg,https://content.homenetiol.com/2001453/2131934/640x480/c44013ef0e7c492dbc28477310bfd05f.jpg,https://content.homenetiol.com/2001453/2131934/640x480/424d738e28dc4c8c94babbd4122f281b.jpg,https://content.homenetiol.com/2001453/2131934/640x480/47c0ce2fd1294f0c8fdcc901c511ecf5.jpg,https://content.homenetiol.com/2001453/2131934/640x480/d9be7f1156ff480f99c843f2ba9dcb53.jpg,https://content.homenetiol.com/2001453/2131934/640x480/e6569ccdf95c4b88ae968dee2a68f260.jpg,https://content.homenetiol.com/2001453/2131934/640x480/ae752128f3d946d4a00742f85667369e.jpg,https://content.homenetiol.com/2001453/2131934/640x480/81e12f209aea4b0a8d81a478b3d8f323.jpg,https://content.homenetiol.com/2001453/2131934/640x480/5deae04eaf01488699e87cf99efa8d9a.jpg,https://content.homenetiol.com/2001453/2131934/640x480/80014edb2f8e4e9fad62f2be456bef29.jpg,https://content.homenetiol.com/2001453/2131934/640x480/25323a455b414bb094f6320f8e7cd5f5.jpg,https://content.homenetiol.com/2001453/2131934/640x480/62c32c47a7ea466ea5b3d1072400b532.jpg,https://content.homenetiol.com/2001453/2131934/640x480/eeabe83b575e48d7a7c4cc58e0047a70.jpg,https://content.homenetiol.com/2001453/2131934/640x480/f823cadc92da43548cafb0d91406ee08.jpg,https://content.homenetiol.com/2001453/2131934/640x480/1fe2d4b4187f49ce82c690c654988587.jpg,https://content.homenetiol.com/2001453/2131934/640x480/c552bc08d45c43cf9ecf02e1f317bc90.jpg,https://content.homenetiol.com/2001453/2131934/640x480/04ad739c4f604b1ea02b5758432add9b.jpg,https://content.homenetiol.com/2001453/2131934/640x480/d9a33de0c7494c4d9a7676edcb24ce19.jpg,https://content.homenetiol.com/2001453/2131934/640x480/8a22a2003fce4141904f6a69442695ee.jpg,https://content.homenetiol.com/2001453/2131934/640x480/b687a33fa3134fb1a2d155f3ffd4f690.jpg,https://content.homenetiol.com/2001453/2131934/640x480/8e1ef30829df492db88ec8df9a9a8249.jpg,https://content.homenetiol.com/2001453/2131934/640x480/40e84549231441a5bbf787debfabb8d2.jpg,https://content.homenetiol.com/2001453/2131934/640x480/ab410dd0b1c347c08ea8afad0cb70ed6.jpg,https://content.homenetiol.com/2001453/2131934/640x480/1d373d64156541a2b767a405f1870fa8.jpg,https://content.homenetiol.com/2001453/2131934/640x480/51f4539d456f4f48899529b546c415fb.jpg,https://content.homenetiol.com/2001453/2131934/640x480/8448a2a741cd407c8d463903b9828a8c.jpg","","","","GBU-1,GBU-2,SWP,CB-0,CF,TE4","","Yes","","30500"
"dealership1","K8559A","Used","3KPF34AD1LE160250","2020","Kia","Forte","GT-Line","C3452","Aurora Black","ABP","Black","WK","","","","","","","Regular Unleaded I-4 2.0 L/122","Variable","33191","10/29/2021","BLACK  CLOTH & LEATHERETTE SEAT TRIM  -inc: white contrast stitching,CARGO NET,AURORA BLACK,REAR BUMPER APPLIQUE,EC MIRROR W/COMPASS & HOMELINK,CARPET FLOOR MATS,GT-LINE PREMIUM PACKAGE  -inc: Dual-Zone Full Automatic Air Conditioning  Power Sunroof  Overhead LED Front & Rear Reading Lamps  Wireless Phone Charger  Radio: AM/FM/MP3 harman/kardon Premium Audio System  320 watts  8 speakers  Clari-Fi digital audio restoration  UVO eServices  voice recognition  SiriusXM satellite radio  2 USB charger ports (front/center console)  support for Android Auto and Apple CarPlay smartphone integration  Bluetooth wireless technology and wireless phone charger  Dual Illuminated Sliding Visor Vanity Mirrors,Front Wheel Drive,Power Steering,ABS,4-Wheel Disc Brakes,Brake Assist,Aluminum Wheels,Tires - Front Performance,Tires - Rear Performance,Heated Mirrors,Power Mirror(s),Integrated Turn Signal Mirrors,Rear Defrost,Intermittent Wipers,Variable Speed Intermittent Wipers,Rear Spoiler,Daytime Running Lights,Automatic Headlights,Fog Lamps,AM/FM Stereo,MP3 Player,Bluetooth Connection,Auxiliary Audio Input,Smart Device Integration,Steering Wheel Audio Controls,Bucket Seats,Pass-Through Rear Seat,Rear Bench Seat,Adjustable Steering Wheel,Trip Computer,Power Windows,Leather Steering Wheel,Remote Trunk Release,Keyless Entry,Power Door Locks,Keyless Start,Keyless Entry,Power Door Locks,Cruise Control,A/C,Cloth Seats,Leather Seats,Driver Vanity Mirror,Passenger Vanity Mirror,Keyless Start,Power Door Locks,Power Windows,Trip Computer,Security System,Engine Immobilizer,Traction Control,Stability Control,Traction Control,Front Side Air Bag,Lane Departure Warning,Lane Keeping Assist,Lane Departure Warning,Front Collision Mitigation,Driver Monitoring,Blind Spot Monitor,Cross-Traffic Alert,Tire Pressure Monitor,Driver Air Bag,Passenger Air Bag,Front Head Air Bag,Rear Head Air Bag,Passenger Air Bag Sensor,Child Safety Locks,Back-Up Camera","4dr Car","GT-Line","4","2.0 L","FWD","<p> Scores 40 Highway MPG and 29 City MPG! This Kia Forte delivers a Regular Unleaded I-4 2.0 L/122 engine powering this Variable transmission. Wheels-Alloy, Tilt Steering, Power Windows. <p><strong>This Kia Forte Comes Equipped with These Options </strong><br /> GT-LINE PREMIUM PACKAGE  -inc: Dual-Zone Full Automatic Air Conditioning, Power Sunroof, Overhead LED Front & Rear Reading Lamps, Wireless Phone Charger, Radio: AM/FM/MP3 harman/kardon Premium Audio System, 320 watts, 8 speakers, Clari-Fi digital audio restoration, UVO eServices, voice recognition, SiriusXM satellite radio, 2 USB charger ports (front/center console), support for Android Auto and Apple CarPlay smartphone integration, Bluetooth wireless technology and wireless phone charger, Dual Illuminated Sliding Visor Vanity Mirrors , Power Mirrors, Power Locks, Cruise Control, Blue-tooth, Backup Camera, Aux Audio Input, Air Conditioning, Air Bags, REAR BUMPER APPLIQUE. </p> <p><strong> Know You're Making a Reliable Purchase </strong><br /> According to Carfax's history report: No Damage Reported, No Accidents Reported, 12 Service Records. </p> <p><strong> Visit Us Today </strong><br> A short visit to Jenkins Kia of Ocala located at 2305 SW College Road, Ocala, FL 34471 can get you a tried-and-true Forte today!</p>","25700","25700","0","https://content.homenetiol.com/2001453/2131934/640x480/41c7d7f0383049e0a4c3a5bb29e8e39c.jpg,https://content.homenetiol.com/2001453/2131934/640x480/6853101ab3b04805b0db528840493fd2.jpg,https://content.homenetiol.com/2001453/2131934/640x480/5b1e0bbfe6834a28bc4cc91c4e44f1ca.jpg,https://content.homenetiol.com/2001453/2131934/640x480/8fdcc487fa524f7bb70d6149cf6a0be2.jpg,https://content.homenetiol.com/2001453/2131934/640x480/02187d942cac466eb50c2a8449d55bfe.jpg,https://content.homenetiol.com/2001453/2131934/640x480/71f6040560bc41e59844b6964779b708.jpg,https://content.homenetiol.com/2001453/2131934/640x480/5922487542ff4469a23156f8a22fdca8.jpg,https://content.homenetiol.com/2001453/2131934/640x480/b36761502fe94742bb2e33bd68e0d7d3.jpg,https://content.homenetiol.com/2001453/2131934/640x480/d189244d29b445d499af3bfd0c9e9868.jpg,https://content.homenetiol.com/2001453/2131934/640x480/73edb4c5ce5e440aa19e9bda7980d3b3.jpg,https://content.homenetiol.com/2001453/2131934/640x480/0cddf628cf04472a9b8cfef712283d21.jpg,https://content.homenetiol.com/2001453/2131934/640x480/c8a070eb93f8429ea3a6bb00cdbf1a3c.jpg,https://content.homenetiol.com/2001453/2131934/640x480/671005e335584684853f6bd784736430.jpg,https://content.homenetiol.com/2001453/2131934/640x480/e7aa593fa18e419d923e8bf73523a54a.jpg,https://content.homenetiol.com/2001453/2131934/640x480/3963d5f19be1435f8ffb594d7e1495ba.jpg,https://content.homenetiol.com/2001453/2131934/640x480/2dfbf16658a544dfb8518d865605f393.jpg,https://content.homenetiol.com/2001453/2131934/640x480/574c700ef25f4786916b3730e1fc2922.jpg,https://content.homenetiol.com/2001453/2131934/640x480/4b908bdc93ce4cd6863fe3044ecfdb45.jpg,https://content.homenetiol.com/2001453/2131934/640x480/5f182f4219f54c899aeea1ede6e6db87.jpg,https://content.homenetiol.com/2001453/2131934/640x480/a4dd6e022fb64e42b0b66a98c120cc0a.jpg,https://content.homenetiol.com/2001453/2131934/640x480/ec44a9c33f3342ebb5bad9f85ef0cee4.jpg,https://content.homenetiol.com/2001453/2131934/640x480/45447a9d78e14c09bce7616124a89db8.jpg,https://content.homenetiol.com/2001453/2131934/640x480/125308cc148f4ffdac1d98e44c6435ea.jpg,https://content.homenetiol.com/2001453/2131934/640x480/252b9820a96e4a2f8c7560076daaff84.jpg,https://content.homenetiol.com/2001453/2131934/640x480/fcf45948ca5e4623ba300e85ff612e53.jpg,https://content.homenetiol.com/2001453/2131934/640x480/6c201439a8f242b9b289ce25bd9fe717.jpg,https://content.homenetiol.com/2001453/2131934/640x480/9c991baa7ec84e27ac6892242f0a576f.jpg","","","","WK-I,CN,ABP,BA,EH,CF,PRC","","Yes","","22900"
